,comments
68,"> The history of slavery and capitalism grew side-by-side.

Unions were segregated in the south. The white unions would only fight for benefits and better equipment for themselves. They let the black workers die and for less pay.

Labor and racism grew up together too. Try to get your head out of the dirt and see the point I'm making as well."
69,"This is literally my goddamn problem. You cut up MLK's speeches to take out literally every mention of race and just keep in the stuff about capitalism.

It is just as bad as when conservatives make their goddamn hackneyed takes about how MLK wants to ignore race.

EVERYTHING MLK DID WAS ABOUT RACE. STOP PULLING THIS BULLSHIT."
70,"And yet it’s eminently clear—in this case as in most cases—that the right wing extremists are a greater threat to marginalized people and more deeply ingrained in the power structures that govern us. Obscuring that fact doesn’t put you on an astute moral high ground, it muddies the reality of who is a threat to us: the radical right. 

You’re not saying outright that the Panthers and the KKK are the same, but you are conflating their historical roles. Even while you protest that you’re not saying they’re the same, you’re thinking of them in the same light: dangerous extremists. Ignoring the reasons for their extremism and their relationship to power is dangerous. Its also something centrists tend to do when it comes to the left and right, which has a lot to do with why liberals are incapable of effectively fighting fascism."
71,You’re comparing the Black Panthers to the KKK
72,"Yes as would I if I saw a woman that reminds me of who I am and whose politics would help me. That's called voting for self interest. White conservatives do it all the time, as do liberals. Your point? 

*I* voted for Obama. My racist father voted for Obama. It was the best choice for many people. Hence the winning of the popular vote. 

If you've  been told, as an American, male, that you could even grow up to be President and it never happens, but one day it does? You vote. It sends a strong message to young people. 

Your comment was meant to seem a little racist and offensive. I'm unwilling to participate in civil discussions with someone who made a point that sounded racist. So, we done."
73,The wealth gap hasn’t substantially budged as far as I can see.
74,"When trying to make a point about his opposition to capitalism, they isolated the sections which refer to capitalism. 

Do you really think leftists are trying to convince you that MLK wasn’t concerned with race? He of course was, and that led him to also be concerned with capitalism. 

Fighting racism and fostering working class solidarity are not two options that we can only choose one of; recognizing the role of capitalism in institutional racism doesn’t remove the focus from racism. Fighting racism, in fact, requires class solidarity. That’s what we’re suggesting to you, not that we shouldn’t—or that MLK thought we shouldn’t—focus on the consequences of racism."
75,"You are wrong. He focused heavily on race, cause he and our people were full on second class citizens here. He also focused on capitalism, which was sustaining the undo hardship placed on us. 

He had a “poor peoples campaign” focused on poverty and the issues pertaining to it."
76,"> which has a lot to do with why liberals are incapable of effectively fighting fascism.

They fought fascism better than the communists at least. Remember the ""liberal"" social democrats (who the communists called ""social fascists"") were the ones resisting against the Nazis at around the time that the communists were chanting ""after Hitler, us"" and going out and beating up the liberals in the streets. And it was the communists who were allying with the Nazis with the Molotov Ribbentrop pact, and who were somehow utterly shocked by the Nazi attack on them and who had to rely on the arsenal of democracy to keep them supplied and in the fight

And the radical left, when in power, more resembled fascists themselves than the liberals have done. Just look at China today, for all the communist rule, the country could easily be argued to be pretty fascist and generally horrid in ways that go well beyond the imperfections of the capitalist liberal states

But it's the *liberals* who are wrong here?"
77,"I'm mot saying they are literally equivalent, just that they are both organizations that did plenty of community work and volunteering and such, but that also did and stood for plenty of bad things. The comparison there feels appropriate. One can oppose the Black Panthers without it being due to ""propaganda"""
78,"We've certainly made appreciable social progress since the 1960s though, because of or in spite of our capitalist economic organization."
79,That’s why I was referring to recent policies as “Optics” because that’s all they are
80,"These are two lines from speeches that went for an hour. How about you post the whole speech and bold the parts that talked about capitalism, so you and I can get a better sense of what his focus was on. Not these butchered paragraphs that are full of ellipses."
81,"
> They fought fascism better than the communists at least. Remember the ""liberal"" social democrats (who the communists called ""social fascists"") were the ones resisting against the Nazis at around the time that the communists were chanting ""after Hitler, us"" and going out and beating up the liberals in the streets. 

And liberals the sicced the Porto-fascist Freikorps on the communists before letting fascists take over their government. 

Liberals attack communists with guns and fascists with words. A communist Germany would not have fallen to fascism, but liberals preferred that it fall to fascism than communism. You’ll do the same in America. 

> And it was the communists who were allying with the Nazis with the Molotov Ribbentrop pact, and who were somehow utterly shocked by the Nazi attack on them and who had to rely on the arsenal of democracy to keep them supplied and in the fight

I mean fuck Stalin but it’s not like the Soviets were dead weight. 

Plus, Hitler was inspired by *American* institutional racism. America did not go to war against Nazi Germany because liberals had a problem with fervent, violent racism. 

> And the radical left, when in power, more resembled fascists themselves than the liberals have done. Just look at China today, for all the communist rule, the country could easily be argued to be pretty fascist 

Not by someone who understands what fascism is. 

> and generally horrid in ways that go well beyond the imperfections of the capitalist liberal states


Yeah cause it’s not like America has anywhere that people of a particular race are imprisoned and doing heavily exploited labor oh wait"
82,"What bad things did the Black Panthers stand by in your view? That’s fair that people can be opposed without it being due to propaganda, but it also depends on the reasoning"
83,Not enough though
84,Even since the 60s.
85,"Cause that seems like sealioning. You claimed he was exclusively about race. I’m demonstrating that he was also about class. I cited his “poor peoples campaigns” as well. 

If he weren’t interested in class nor in challenging capitalism, he wouldn’t have made that campaign with those sentiments."
86,"The separatism/black nationalism stuff (more understandable than white nationalism, but racial nationalism in general is bad). The Marxism (an ideology that killed dozens of millions of people and has never worked out in the real world nearly as well as capitalism). And there was a lot of general crime within the movement too, stuff like killing cops, drug dealing, extortion of local businesses, some assassinations and assassination attempts, and so on

Doesn't seem like the sort of organization that deserves any respect or positive regard"
87,"> What bad things did the Black Panthers stand by in your view? 

They were goddamn black nationalists, are you nuts?"
88,"Of course, but we should be able to recognize the progress we have made and tout it, it’ll help sell progressive ideals since that’s how we’ve made the progress we’ve seen."
89,"MLK did not advocate for those programs to bring down capitalism, he did it because they would help black people. When he fought for a union, it was because it was a black union. If he fought housing insecurity, it was because black people suffer from a lack of home ownership. 

Everyone benefitted from the Civil Rights Act, but he didn't support it for what it would do for Asians and Indians. He. did. it. for. black. people.

So when you hijack these throwaway lines, and I want you to see them in their full context, I'm not goddamn trolling you. I want you to see it outside the lens of some shitty socialist site."
90,How should they have approached their second class citizenship in a country that was actively and passively killing them?
91,In a time where they were full on second class citizens. Makes sense to me considering American history and their place in it.
92,"You think MLK was for black rights exclusively as well??? 

Was the poor peoples campaign, exclusively for black people?"
93,"Peacefully and nonviolently like decent people

It's not like the successes of the civil rights movement were accomplished by extremist separatist Marxist radicals. They were accomplished by reformers who worked within the system and peacefully. That's the way to do it"
94,"Now who the fuck is strawmanning here. I mean what I said in the way that I said it. If you got a problem, then quote it at me."
95,The civil rights movement didn’t win. It just lessened oppression.
96,"Holy shit is that insulting

There’s still a wealth gap between black and white and POC are still more heavily incarcerated than whites. Institutional racism is alive and well precisely because working within a white supremacist system cannot end white supremacy.

I make a point not to tell oppressed people that they’re fighting their oppression to violently, because I recognize the violence represented by the status quo. In my opinion, doing otherwise is deeply disrespectful."
97,"“Everyone benefitted from the CRA, but he didn’t support it for what it would do for Asians and Indians. He did. It. For. Black. People”"
98,"I'd consider that a big win

Feels like some people are unable to be satisfied or take anything as a win other than a total and complete victory (or at least it comes off that way). And I don't think that's healthy at all. It's not good to take a partial victory as a reason to do nothing more, either, but I think it's important to have a balance. If folks on the left will always be unsatisfied and unwilling to celebrate any progress as a genuine win, that mindset seems like the sort that could be especially prone to burnout, as well as coming off as astoundingly joyless and unpleasant to other people on the fence who could otherwise potentially be winnable in terms of agreement and/or getting them involved in activism

If nothing - not even things like the civil rights movement which brought massive positive change - is a win, why bother at all, with activism or even just voting?"
99,There's no alternative to peaceful reform. Violent revolution will simply be defeated
100,"If somebody said MLK was an advocate for Asian people, I’d call that black erasure as well. Wouldn’t you?

Y’all need to stop trying to hijack mlk. That is my only point."
101,"Cause the civil rights movement was “a” win, but their cause didn’t achieve victory. Simple as that. 

“Feel like some people are unable to be satisfied or take anything as a win other there than a total and complete victory”. When the discussion is about equality and having our humanity recognized and our rights defended, less than total and complete victory is a problem, no?"
102,"Yeah, by *you*"
103,"I’d call it that too. But that’s different from what you claiming. And I’m not hijacking MLK. He fought for racial equality, he and the black community together fought for those advances, and he fought for economic justice."
104,"For huge and complicated issues like these, we are *never* going to see any sort of change that just immediately makes everything perfect

It's a long hard fight that will involve lots of incremental change, and it probably won't be solved in our lifetimes or even the lifetimes of our children and grandchildren

But it's hard to look at how things were 100 or 200 years ago, and *not* say we've come a damn long way and done a whole lot of good

There's always going to be problems, but I say every step forward is a win, even if just a small one

Get enough of those smaller wins over the next few centuries and maybe things will actually be ok by then

But if we don't recognize steps forward as wins, it makes it easy to say ""fuck it, why even bother stepping forward then"""
105,"No, by the institutions of a society where the average person is well to the right of me"
106,"You’ll note this thread started cause someone called him a socialist. I agree he fought for economic justice, I just think trying to ascribe that label to him is playing an agenda."
107,"Liberals love to tell oppressed people to ask their oppressors nicely for freedom, because you can somehow simultaneously believe that a system is oppressive while also believing it’s just and democratic. I don’t think that paternalistic attitude is conducive to combatting institutional racism."
108,That’s not enough. We will continue to press for more and continue to have grievances about not having it.
109,"Institutions which you support. You already made it clear that your problem with violent revolution is moral, not strategic."
110,"That’s noted. I’m not calling him a socialist, but I don’t think he supported capitalism as it is. He and his allies achieved an end to many forms of legalized discrimination. But he could see that the racial gaps in quality in life would persist as long as they were rooted in our economic system, which was sabotaged against racial minorities (especially black people) for generations. Without changing capitalism or addressing the financial wealth gap created by not being able to accrue wealth legally for centuries, the gaps in quality of life will go nowhere."
